borders_description,name_river_basin
"""Водохозяйственные участки гидрографической единицы бассейнового уровня 03.04.00 охватывают бассейны рек Баренцева моря междуречье Печоры и Мезени и почти целиком расположены на территории Ненецкого автономного округа. Северная граница проходит по побережью Чешской губы, Поморского пролива и Печорской губы, с юго-востока она совпадает с границей бассейна р. Печора, а с юга и запада - граничит с бассейном р. Мезень. Территория гидрографической единицы, простираясь с запада на восток, практически целиком, за исключением лесотундрового юго-западного участка, расположена в тундровой зоне Русской равнины. Природные условия изменяются в широтном направлении. На севере распространена зона мохово-лишайниковой арктической тундры, южнее - кустарниковые тундры с многочисленными мелкими озерами и болотами. Зона лесотундры характеризуется сочетанием редколесий с безлесными тундровыми участками. Пониженные прибрежные участки нередко заняты солончаковыми лугами.""","""Бассейны рек Баренцева моря междуречья Печоры и Мезени"""
"""Водохозяйственные участки гидрографической единицы бассейнового уровня 19.05.00 охватывают бассейн реки Анадырь и расположены на крайнем востоке России на территории Чукотского автономного округа. Восточная часть территории бассейна расположена на Анадырской низменности, на западе водоразделом служит Колымское нагорье, Неутенский хребет и Анадырское плоскогорье.""",Анадырь
"""Водохозяйственный участок, соответствующий гидрографической единице бассейнового уровня 20.01.00, охватывает бассейны рек Охотского моря от отрогов хребта Сунтар-Хаята на севере до границы бассейна р. Уда на юге и расположен на территории Хабаровского края. На севере и северо-востоке участок граничит с бассейнами Индигирки и Колымы, на востоке омывается водами Охотского моря, на юге граничит с бассейном Уды и на западе – с бассейном Лены.""","""Бассейны рек Охотского моря от х.Сунтар-Хаята до Уды"""
"""Водохозяйственные участки гидрографической единицы бассейнового уровня 06.02.00 охватывают бассейн р. Кубань и рек бассейна Азовского моря до Бейсугского лимана. Природные условия здесь чрезвычайно разнообразны, что связано с дифференциацией геоморфологического строения территории: с севера на юг степи Западного Предкавказья здесь сменяются горными ландшафтами Северо-Черноморской, Колхидской и Северо-Кавказской провинций Большого Кавказа.""",Кубань
"""Водохозяйственные участки гидрографической единицы бассейнового уровня 20.05.00 охватывают бассейны рек острова Сахалин с прилегающими островами и Курильских островов. Остров Сахалин расположен у восточных берегов Евразийского материка, омывается водами Охотского и Японского морей. От материка отделен Татарским проливом, ширина которого в самом узком месте (пролив Невельского) 7,3 км, на юге от о. Хоккайдо (Япония) отделен проливом Лаперуза. Остров вытянут меридионально, его длина 948 км, при средней ширине около 100 км. Площадь 76,4 тыс. км2.""","""Бассейны рек о. Сахалин"""
"""Водохозяйственные участки гидрографической единицы бассейнового уровня 18.01.00 расположены на северо-востоке Средне-Сибирского плоскогорья и охватывают бассейн р. Анабар, а также реки бассейна моря Лаптевых от восточной границы бассейна р. Тикян-Юрях на западе до западной границы бассейна р. Оленек на востоке. С западной стороны бассейн ограничен кряжем Сюрех-Джанзы, юго-западная часть расположена на Анабарском плато, северная часть бассейна находятся в пределах Северо-Сибирской низменности с востока ограниченной кряжем Прончищева. С восточной стороны водохозяйственные участки гидрографической единицы граничат с бассейном р. Оленек, на западе – с бассейнами рр. Попигай и Хатанга, северная граница бассейна проходит по береговой линии моря Лаптевых.""",Анабар
"""Водохозяйственные участки гидрографической единицы бассейнового уровня 16.03.00 расположены на юге Восточной Сибири и охватывают территорию российской части бассейна р. Селенга. На севере бассейн Селенги граничит с бассейнами рек, впадающих в оз. Байкал, на северо-востоке – с бассейном р. Лены, на юго-востоке – с бассейном р. Амура, на юге граница проходит по Государственной границей РФ с Монголией и на западе гидрографическая единица граничит с бассейном Ангары.""","""Селенга (российская часть бассейна)"""
"""Водохозяйственные участки гидрографической единицы бассейнового уровня 21.02.00 расположены в восточной части полуострова Крым и охватывают бассейны рек, впадающих в Азовское море, в том числе в залив Сиваш. С запада и юга они граничат с бассейнами рек полуострова Крым, впадающими в Черное море.""","""Реки полуострова Крым бассейна Азовского моря"""
"""Водохозяйственный участок гидрографической единицы бассейнового уровня 15.03.00 охватывает территорию бассейна р. Надым. Бассейн занимает северную часть Западно - Сибирской низменности, с востока он ограничен возвышенностью Сатты, с запада – Полуйской возвышенностью. Бассейн практически целиком располагается на территории Ямало-Ненецкого автономного округа. Северная граница бассейна Надыма омывается водами Обской губы Карского моря, на востоке бассейн граничит с бассейном р. Пур, на юге и западе - c бассейном р. Оби. Своеобразие территории придает широкое распространение песчаных отложений и связанных с этим специфических эоловых форм рельефа.""",Надым
"""Водохозяйственные участки гидрографической единицы бассейнового уровня 06.01.00 расположены на юге Европейской территории России и охватывают реки бассейна Азовского моря междуречья Кубани и Дона. С севера и востока они граничат с бассейном Дона, с юга - с бассейном Кубани, с запада граница проходит по береговой линии Азовского моря. Главными реками территории являются реки Ея, Челбас, Кирпили и Бейсуг. Особенности природных условий территории определяются ее положением на юге степной зоны Русской равнины - это равнинная часть Западно-Предкавказской физико-географической провинции.""","""Реки бассейна Азовского моря междуречья Кубани и Дона"""
"""Водохозяйственные участки гидрографической единицы бассейнового уровня 07.01.00 расположены на юго-востоке Европейской территории России и охватывают бассейны рек Каспийского моря междуречья Терека и Волги. На западе территории расположена Ставропольская возвышенность, северо-западная граница проходит по Ергенинской возвышенности, на юго- западе – по отрогам Кавказского хребта, восточная часть территории расположена в пределах Прикаспийской низменности, часть границы проходит по береговой линии Каспийского моря.""","""Реки бассейна Каспийского моря междуречья Терека и Волги"""
"""Водохозяйственные участки гидрографической единицы бассейнового уровня 18.04.00 охватывают бассейн реки Яна и рек бассейна моря Лаптевых, впадающих в него между Леной и Индигиркой, и расположена в северо-восточной части Восточной Сибири. Территория гидрографической единицы ограничена крупными горными массивами. С западной стороны граница с бассейном Лены проходит по гребню Верхоянского хребта. Юго-восточная часть Янского бассейна расположена на поверхности Эльгинского плоскогорья, восточная граница с бассейном Индигирки проходит по хребту Черского. В северной приморской части Яна протекает по Яно- Индигирской низменности.""",Яна
"""Водохозяйственные участки гидрографической единицы бассейнового уровня 07.03.00 расположены на юго-востоке Европейской территории России и охватывают бассейны рек, впадающих в Каспийское море, расположенных между бассейном Терека и Государственной границей РФ с Республикой Азербайджан. Южная и западная граница гидрографической единицы проходит по хребтам Кавказа и его отрогов, северная и восточная часть территории расположена в пределах Прикаспийской низменности, часть границы проходит по береговой линии Каспийского моря.""","""Реки бассейна Каспийского моря на юг от бассейна Терека до Государственной границы РФ (российская часть бассейнов)"""
"""Водохозяйственные участки гидрографической единицы бассейнового уровня 19.01.00 охватывают территорию бассейна р. Колыма. Бассейн располагается на территории Республики Саха (Якутия), Магаданской области и Чукотского автономного округа. Северная граница бассейна Колымы омывается водами Восточно-Сибирского моря, на востоке бассейн граничит с бассейнами рек Анадырь и Пенжина, на юге и юго-востоке - с бассейнами рек Охотского моря, на западе – с бассейнами Индигирки и Алазеи. На востоке граница бассейна проходит по отрогам Анюского и Олойского хребтов и далее на юго-восток по Колымскому нагорью, на юго-западе и западе – по отрогам хребта Черского и Момского хребта и далее через Алазейское плоскогорье граница бассейна по Колымской низменности выходит к побережью Восточно-Сибирского моря.""",Колыма
"""Водохозяйственные участки гидрографической единицы бассейнового уровня 18.02.00 охватывают бассейн р. Оленек. Западная граница гидрографической единицы проходит по водоразделу с бассейном р. Анабар и тянется по Северо-Сибирской низменности и Анабарскому плато, на юге бассейн р. Оленек граничит с бассейнами притоков р. Хатанга, юго-восточная часть бассейна, расположенная на Вилюйском плато, и вся восточная часть до впадения р. Оленек в море Лаптевых, граничат с бассейном р. Лены.""",Оленек
"""Водохозяйственные участки гидрографической единицы бассейнового уровня 19.06.00 охватывают бассейны рек Берингова моря южнее бассейна Анадыря и расположены на крайнем востоке России на территории Чукотского, Корякского автономных округов и Камчатской области. Восточная часть границ водохозяйственных участков омывается водами Берингова моря, на юге и юго-западе она граничит с бассейном р. Камчатка и водохозяйственными участками гидрографической единицы 19.08.00 реки Камчатки бассейна Охотского моря (до Пенжины), и на северо-западе – с бассейном Анадыря.""","""Бассейны рек Берингова моря (южнее Анадыря)"""
"""Водохозяйственные участки гидрографической единицы бассейнового уровня 19.02.00 охватывают бассейны рек Восточно-Сибирского моря и целиком расположены на территории Чукотскогоавтономногоокруга.Севернаячастьграницыгидрографическойединицыпростирается по берегу Восточно-Сибирского моря, на востоке она граничит бассейнами рек Чукотского моря, на юге - с бассейном Анадыря и на западе – с бассейном Колымы.""","""Бассейны рек Восточно-Сибирского моря восточнее Колымы"""
"""Водохозяйственные участки гидрографической единицы бассейнового уровня 19.08.00 охватывают бассейны рек Охотского моря на западном склоне полуострова Камчатка. Западная часть границы омывается водами Охотского моря, на востоке она граничит с водохозяйственными участками гидрографической единицей 19.06.00 - бассейны рек Берингова моря (южнее Анадыря) и бассейном р. Камчатка и на севере – с бассейном Пенжины.""","""Реки Камчатки бассейна Охотского моря (до Пенжины)"""
"""Водохозяйственные участки гидрографической единицы бассейнового уровня 03.06.00 охватывают бассейны рек Баренцева моря междуречья Печоры и Оби и расположены на территории Ненецкого автономного округа. Северная часть границы бассейна простирается по берегу Баренцева моря, восточная - граничит с гидрографической единицей 15.01.00 - реки бассейна Карского моря междуречья Печоры и Оби, на юге и западе - с бассейном Печоры. Бассейны рек Баренцева моря междуречья Печоры и Оби располагаются в Малоземельско- Большеземельской ландшафтной провинции тундровой зоны Русской равнины.""","""Бассейны рек Баренцева моря междуречья Печоры и Оби"""
"""Единственный водохозяйственный участок гидрографической единицы бассейнового уровня 01.05.00 охватывает трансграничные реки бассейна Балтийского моря, протекающие на территории Российской Федерации в Республике Карелия. Большая часть бассейна водохозяйственного участка – западный склон Западно-Карельской возвышенности и северная часть Карельского перешейка.""","""Реки Карелии бассейна Балтийского моря (российская часть бассейнов)"""
"""Единственный водохозяйственный участок гидрографической единицы бассейнового уровня 18.06.00 охватывает бассейны р. Алазея и рек побережья Восточно-Сибирского моря, впадающих в него между Индигиркой и Колымой. Большую часть бассейна занимает Колымская низменность, лишь в юго-западной части рельеф повышен на поверхности Алазейского плоскогорья.""",Алазея
"""Водохозяйственные участки гидрографической единицы 13.02.00 охватывают бессточную территорию междуречья в верховьях бассейнов Оби и Иртыша и расположены на территории Барабинской низменности и Кулундинской равнины. Территория представляет собой плоскую или плоско-западинную слабонаклонную равнину с мелкими и крупными солоноватыми и солеными озерами. Зональные ландшафты представлены разнотравно-ковыльными и типчаково-полынными степями. По берегам озер часты заросли высокостебельных болотных растений (тростника, камыша, рогоза), а также осок и ивы. Гидрографическая единица находится на юге Западной Сибири и граничит на севере с бассейном Иртыша, на востоке - с бассейном Оби, на юге граница гидрографической единицы совпадает с Государственной границей РФ с Республикой Казахстан.""","""Бессточная область междуречья Оби и Иртыша"""
"""Водохозяйственные участки гидрографической единицы бассейнового уровня 21.01.00 расположены в западной и южной частях полуострова Крым и охватывают бассейны рек, стекающих в Черное море. С востока и севера они граничат с бассейнами рек Крымского полуострова, впадающими в Азовское море (и залив Сиваш). С юга и запада – ограничены береговой линией Черного моря.""","""Реки полуострова Крым бассейна Черного моря"""
"""Водохозяйственные участки гидрографической единицы бассейнового уровня 19.03.00 охватывают бассейны рек Чукотского моря и целиком расположены на территории Чукотского автономного округа на крайнем северо-востоке России. Северная часть границы простирается по берегу Чукотского моря, на востоке и юге она граничит с водохозяйственными участками гидрографической единицы 19.04.00, на западе - с бассейном Анадыря и бассейнами рек Восточно - Сибирского моря восточнее Колымы.""","""Бассейны рек Чукотского моря"""
