borders_description,name_river_basin
"""Водохозяйственный участок гидрографической единицы бассейнового уровня 17.03.00 охватывает бассейн реки Нижняя Таймыра и других малых и средних рек севера Таймырского полуострова. С запада и юга участок граничит с бассейном р. Пясина, с востока- с бассейном р. Хатанга, северная граница проходит по побережью Карского моря. Территория целиком расположена за полярным кругом и характеризуется тундровыми ландшафтами.""","""Нижняя Таймыра"""
"""Водохозяйственные участки гидрографической единицы бассейнового уровня 16.01.00 расположены на территории бассейна р. Ангара от истока (включая акваторию оз. Байкал) до устья. На севере и западе гидрографическая единица бассейнового уровня 16.01.00 граничит с бассейном Енисея, на востоке – с бассейном Лены, на юго-востоке – с бассейном Амура, на юге граница совпадает с Государственной границей РФ с Монголией.""",Ангара
"""Водохозяйственные участки гидрографической единицы бассейнового уровня 01.03.00, охватывают российскую часть бассейна р. Нарва и бассейны рек российской части южного побережья Финского залива. В южной и юго-восточной частях бассейна расположены Бежаницкая и Судомская возвышенности, в центральной части бассейна – Лужская возвышенность, с запада бассейн ограничивает возвышенность Хаанья, а также акватории Псковского и Чудского озер.""","""Нарва (российская часть бассейна)"""
"""Водохозяйственные участки гидрографической единицы бассейнового уровня 19.10.00 охватывают бассейны рек Охотского моря, берущих начало, главным образом, с юго-восточных склонов Колымского нагорья, расположенных южнее бассейна р. Пенжина до отрогов хребта Сунтар-Хаята. Большая часть бассейна водохозяйственных участков расположена на территории Магаданской области. Южная граница их омывается водами Охотского моря, на западе они граничат с водохозяйственными участками 20.01.00 - бассейны рек Охотского моря от хр. Сунтар- Хаята до Уды, на севере – с бассейнами Колымы и Пенжины.""","""Бассейны рек Охотского моря от Пенжины до х.Сунтар-Хаята"""
"""Водохозяйственные участки гидрографической единицы бассейнового уровня 07.02.00 расположены на юго-востоке Европейской территории России и охватывают бассейн реки Терек. На западе территории гидрографической единицы расположена Ставропольская возвышенность, южная граница проходит хребтам Большого Кавказа, восточная часть территории расположена в пределах Прикаспийской низменности, часть границы проходит по береговой линии Каспийского моря.""","""Терек (российская часть бассейна)"""
"""Водохозяйственные участки гидрографической единицы бассейнового уровня 01.04 охватывают водосбор Онежского озера и р. Свирь, всю российскую часть водосбора трансграничной р. Волхов, российскую часть бассейнов р. Нева, Ладожского озера и рек Карельского перешейка.""","""Нева (включая бассейны рек Онежского и Ладожского озера)"""
"""Водохозяйственные участки гидрографической единицы бассейнового уровня 10.01.00 охватывают восточную окраину Русской равнины и западную часть Уральских гор. На северо-востоке граничат с Двинско-Печорским бассейновым округом, на востоке - с Иртышским бассейновым округом, на юге - с Уральским бассейновым округом, на юго-западе - с Нижневолжским бассейновым округом и на западе – с Верхневолжским бассейновым округом.""",Кама
"""Водохозяйственные участки гидрографической единицы бассейнового уровня 09.01.00, охватывающей бассейн р. Ока, расположены на Европейской части России. Гидрографическая единицы бассейнового уровня 09.01.00 граничит с запада с бассейном р. Днепр (гидрографическая единица 04.01.00), с севера и северо-востока с бассейном (Верхней) Волги (гидрографическая единица 08.01.00), с юга - с бассейном Дона (гидрографическая единица 05.01.00).""",Ока
"""Водохозяйственные участки гидрографической единицы бассейнового уровня 16.04.00 расположены на юге Восточной Сибири и охватывают бассейны рек, впадающих в оз. Байкал в его северной и средней части. На большей части территории гидрографическая граница граничит с бассейном р. Лены и лишь на юго-западе – с бассейном р. Ангары и на восточном побережье Байкала – с бассейном р. Селенги. Внутренняя часть границы гидрографической границы проходит по берегу оз. Байкал.""","""Бассейны рек средней и северной части оз. Байкал"""
"""Водохозяйственные участки гидрографической единицы бассейнового уровня 03.02.00 охватывают бассейн р. Северной Двины и занимают центральную часть Архангельской области. Она граничит на западе с бассейном р. Онега, на востоке - с бассейном р. Мезень и с бассейном р. Печора, на юге - с бассейном р. Кама и с бассейном р. Волга, северная граница проходит по побережью Двинской губы Баренцева моря. Бассейн р. Северная Двина расположен в Пинего-Двинской, Онежско-Двинской и Мезенско- Двинской ландшафтных провинциях лесной зоны Русской равнины.""","""Северная Двина"""
